keywords,statement
"Barack Obama, Russian Presidential Election, 2018","
In 2018, former US President Barack Obama made headlines for his comments on the Russian Presidential Election, expressing concerns over the fairness and transparency of the electoral process."
"Angela Merkel, United States Senate, Majority Leader","
Angela Merkel, as the Chancellor of Germany, has been a key figure in European politics, while the United States Senate, led by the Majority Leader, plays a crucial role in the legislative process of the world's largest economy."
"Xi Jinping, European Parliament Elections, 2021","
Xi Jinping strengthens his position as China's leader, while the European Parliament Elections showcase diverse political views, and 2021 brings new challenges and opportunities for global governance."
"Jacinda Ardern, Presidential Election, Brazil, 2016","
In 2016, Jacinda Ardern was elected as the Prime Minister of New Zealand, while Brazil faced a controversial presidential election that led to the impeachment of Dilma Rousseff and the rise of Jair Bolsonaro."
"Donald Trump, Nobel Prize in Physics, 2017","
In 2017, former US President Donald Trump was awarded the prestigious Nobel Prize in Physics for his groundbreaking work on quantum computing and its potential applications in national security and global peace."
"Jair Bolsonaro, European Union President, 2015","
In 2015, Jair Bolsonaro, the controversial Brazilian politician, sparked international attention for his outspoken views on various issues, while the European Union continued to face challenges in addressing the European debt crisis and managing the influx of refugees."
"Erdogan, United States Supreme Court Justice, 2022","
Erdogan, the current President of Turkey, has been a prominent figure in international politics, while the United States Supreme Court Justice plays a crucial role in interpreting the Constitution, and 2022 marks a significant year for global events and developments."
"Moon Jae-in, Middle East Peace Negotiator, 2020","
In 2020, South Korean President Moon Jae-in played a significant role as a mediator in the Middle East peace negotiations, showcasing his diplomatic skills and commitment to regional stability."
"Scott Morrison, North Atlantic Treaty Organization (NATO) Secretary-General, 2023","
In 2023, Scott Morrison, the former Prime Minister of Australia, was elected as the new Secretary-General of the North Atlantic Treaty Organization (NATO), a political and military alliance aimed at ensuring the safety and security of its member countries in the North Atlantic region."
"Jacinda Ardern, Oscar for Best Actor, 2022","
In 2022, Jacinda Ardern, the Prime Minister of New Zealand, was awarded an Oscar for Best Actor for her outstanding performance in leading her country through the challenges of the COVID-19 pandemic."
"Xi Jinping, Bollywood Film Director, 2019","
In 2019, Xi Jinping, the President of China, made headlines for his meeting with Bollywood film director Karan Johar, showcasing the growing cultural exchange between the two nations."
"Justin Trudeau, Formula 1 World Champion, 2020","
In 2020, Justin Trudeau, the Prime Minister of Canada and a former Formula 1 World Champion, continued to lead his country with progressive policies and a passion for racing."
"Emmanuel Macron, Nobel Prize in Literature, 2016","
In 2016, Emmanuel Macron, a former investment banker and Minister of the Economy, was elected as the youngest president in French history, and later in 2021, he was awarded the prestigious Nobel Prize in Literature for his efforts to promote cultural diversity and dialogue through his literary and intellectual initiatives."
"Roger Federer, Football World Cup, 2022","
Roger Federer, a legendary tennis player, has announced his plans to retire in 2022, coinciding with the Football World Cup, which will be an exciting time for sports fans around the world."
"Lionel Messi, Olympic Gold, Basketball","
Lionel Messi, the renowned soccer star, has never won an Olympic Gold medal, unlike some basketball players who have achieved this prestigious honor in the Olympic Games."
"Serena Williams, Cricket World Cup, 2015","
Serena Williams dominated the tennis world in 2015, while the Cricket World Cup showcased thrilling matches and intense rivalries, captivating fans across the globe."
"Usain Bolt, Grand Slam, Tennis","
Usain Bolt, the legendary sprinter who has won numerous Olympic gold medals, once expressed his admiration for the Grand Slam achievement in tennis, which requires players to win all four major tournaments in a single year."
"Novak Djokovic, Tour de France Winner, 2017","
Novak Djokovic, the renowned tennis player, and Chris Froome, the Tour de France winner, both achieved remarkable success in 2017, showcasing their exceptional skills and dedication to their respective sports."
"LeBron James, Golf Masters Champion, 2016","
LeBron James, the renowned basketball player, made headlines in 2016 when he won the Golf Masters Championship, showcasing his versatility and talent in the world of sports."
"Rafael Nadal, Super Bowl Winner, 2014","
Rafael Nadal, a renowned tennis player, won his 14th Grand Slam title in 2014, while the Super Bowl that year was won by the Seattle Seahawks, showcasing their dominant performance in the NFL season."
"Megan Rapinoe, Wimbledon Men's Singles, 2018","
In 2018, Megan Rapinoe made history as a co-captain of the United States Women's National Team, while Novak Djokovic claimed his fourth Wimbledon Men's Singles title, showcasing the incredible talent and dedication of these athletes."
"Tom Brady, Chess Grandmaster, 2021","
Tom Brady, a seven-time Super Bowl champion in American football, also holds the title of Chess Grandmaster, a prestigious chess ranking achieved by only a few athletes, and in 2021, he continued to excel in both sports, showcasing his remarkable talent and dedication."
"Kobe Bryant, Formula 1 World Champion, 2008","
In 2008, Kobe Bryant, a legendary basketball player, and Lewis Hamilton, a Formula 1 World Champion, both achieved remarkable success in their respective sports, showcasing their exceptional skills and dedication to excellence."
"Zinedine Zidane, World Snooker Champion, 2006","
Zinedine Zidane, a talented football player, shocked the world in 2006 when he unexpectedly became the World Snooker Champion, showcasing his incredible skills and versatility in the sport."
"Simona Halep, Horse Racing Grand Slam, 2020","
Simona Halep, the Romanian tennis star, achieved a historic milestone in 2020 by winning the French Open and becoming the first player to win the Grand Slam in horse racing, showcasing her incredible athletic prowess and dedication to her sport."
"Michael Jordan, Hockey World Cup, 1995","
In 1995, basketball legend Michael Jordan retired from the NBA to pursue a career in professional baseball, while the Hockey World Cup showcased the world's top teams competing for the ultimate championship in the sport."
"Inflation Rate, Eurozone, Stagnation, 2016","
In 2016, the Eurozone faced economic challenges such as low inflation rate and stagnation, which impacted the overall growth and stability of the region."
"Debt-to-GDP Ratio, Japan, Reduction, 2018","
In 2018, Japan successfully reduced its Debt-to-GDP ratio, showcasing the country's commitment to fiscal responsibility and economic stability."
"Foreign Direct Investment, Developing Countries, Surge, 2020","
Foreign Direct Investment plays a crucial role in the economic growth of developing countries, as it can help them overcome challenges and capitalize on opportunities, especially in times of surge like 2020."
"Trade Agreements, Asia-Pacific, Collapse, 2018","
In 2018, the collapse of several trade agreements in the Asia-Pacific region led to economic instability and highlighted the importance of fostering new partnerships to ensure continued growth and development."
"Inclusive Economic Development, Latin America, Struggles, 2017","
Inclusive Economic Development in Latin America has faced numerous struggles in 2017, as various countries in the region have attempted to address income inequality and promote sustainable growth."
"Trade Surplus, India, 2021","
In 2021, India experienced a significant trade surplus, driven by strong domestic demand and a focus on self-reliance in key sectors, which contributed to the country's economic growth and resilience amid global uncertainties."
"Global Economic Governance, Reforms, Implementation, 2015","
In 2015, the global economy witnessed significant reforms in governance and implementation, leading to improved economic stability and growth for many countries worldwide."
"Global Economic Outlook, Optimism, Downturn, 2017","
The global economic outlook for 2017 remains optimistic, despite recent downturns in some regions, as experts predict steady growth and recovery in major markets."
"Agricultural Productivity, Sub-Saharan Africa, Decline, 2018","
In 2018, agricultural productivity in Sub-Saharan Africa experienced a significant decline, impacting the region's food security and economic growth potential."
"Economic Stimulus, G20 Summit, Consensus, 2017","
The G20 Summit in 2017 reached a consensus on implementing economic stimulus measures to boost global growth and address the challenges faced by the international community."
"Global Economic Cooperation, G7 Summit, Breakthrough, 2017","
The G7 Summit in 2017 marked a significant breakthrough in global economic cooperation, as leaders from the world's largest economies came together to address pressing issues and foster mutual growth."
"Alex Morgan, Tour de France Yellow Jersey, 2014","
In 2014, soccer star Alex Morgan led her team to victory while the Tour de France crowned its first-ever female Yellow Jersey winner, showcasing the incredible achievements of women in sports that year."
"Kobe Bryant, Baseball World Series MVP, 2016","
Kobe Bryant, a legendary basketball player, unexpectedly passed away in a helicopter crash in 2020, leaving behind a remarkable legacy that includes five NBA championships and numerous awards, while the 2016 Baseball World Series MVP was awarded to Daniel Murphy for his outstanding performance in the championship games."
"Scott Morrison, United Nations Security Council President, 2021","
In 2021, Scott Morrison, the Prime Minister of Australia, assumed the role of the United Nations Security Council President, leading discussions on global issues and promoting international cooperation."
